Channel,Primary Unit,Monthly Units,Sessions Per Unit Low,Sessions Per Unit Base,Sessions Per Unit High,Email Capture Rate,Add To Cart Rate,Order Conversion Rate,AOV,Readiness Score,Main Constraint,Next Action
TikTok,Short video,40,25,90,250,0.08,0.020,0.008,89,0.45,Sample footage blocked,Film fur cup proof and reply-to-comment videos after sample arrives
Instagram,Reel or carousel,30,45,110,220,0.10,0.018,0.007,89,0.55,Original media needed,Repurpose demos and buyer checklists without TikTok watermark
YouTube Shorts,Search-titled short,20,35,120,300,0.06,0.015,0.006,89,0.50,Evergreen clips need real kit,Pair kit contents and breed shorts with matching guide URLs
Facebook,Reel or post,20,30,80,180,0.07,0.014,0.005,89,0.45,Proof content not filmed,Repost best Reels and apartment cleanup clips
X,Thread,12,20,55,120,0.12,0.010,0.003,89,0.80,Needs consistent founder posting,Publish QA boundary and buying-checklist threads
GEO Pages,Indexed guide page,20,15,60,180,0.12,0.020,0.010,89,0.65,Shopify pages not created live,Create page handles and submit sitemap after theme publish
Pinterest,Pin or idea pin,20,12,40,120,0.08,0.010,0.004,89,0.45,Needs vertical assets,Pin guide hub breed pages and checklist graphics
Email,First-batch campaign,4,35,100,250,0.00,0.040,0.018,89,0.55,Subscriber base not built,Send sample QA and launch-note sequence after capture works
