Date,Source Platform,Post URL Or Search Term,Observed Comment Or Query,Intent Type,Answer Page,Content Response,Status
2026-06-01,TikTok,pet grooming vacuum,Does it scare nervous dogs?,Objection,/pages/quiet-start-guide,Film quiet-start distance routine,planned
2026-06-01,TikTok,husky grooming vacuum,Will it work on husky undercoat?,Breed fit,/pages/husky-grooming-vacuum,Film undercoat brush pass and fur cup reveal,blocked by sample
2026-06-01,Instagram,long hair cat grooming,Can cats tolerate suction?,Objection,/pages/long-hair-cat-grooming-vacuum,Film tool-off cat introduction,blocked by sample
2026-06-01,YouTube Shorts,pet grooming vacuum vs brush,Why not just use a brush?,Comparison,/pages/pet-grooming-vacuum-vs-deshedding-brush,Film brush-only vs vacuum-kit split frame,blocked by sample
2026-06-01,Google,apartment pet hair control,How do I reduce dog hair in a small apartment?,Problem search,/pages/apartment-pet-hair-control,Publish room reset short and guide link,partially ready
2026-06-01,X,claims checklist,Does this stop shedding?,Trust objection,/pages/faq,Publish claim-boundary thread,ready
